<?xml version="1.0" encoding="UTF-8"?>
<p:Akt 
xmlns:p="http://www.parlament.gov.rs/propisi"
xmlns="http://www.w3.org/ns/rdfa#"
xmlns:pred="http://www.parlament.gov.rs/propisi/predicate/" 
xmlns:xsd="http://www.w3.org/2001/XMLSchema" 
xmlns:xsi="http://www.w3.org/2001/XMLSchema-instance" 
xsi:schemaLocation="http://www.parlament.gov.rs/propisi ../../schema/akt.xsd ">
  <p:Glavni_deo/>
<p:Sporedni_deo about="http://www.parlament.gov.rs/propisi/akti/u_proceduri/doc8">
    <p:Akt_u_proceduri>
      <p:Predlagac>p:Predlagac</p:Predlagac>
      <p:Upucuje_se>p:Upucuje_se</p:Upucuje_se>
      <p:Meta_podaci>
        <p:Oznaka property="pred:oznaka" datatype="xs:string">doc8</p:Oznaka>
        <p:Mesto property="pred:mesto" datatype="xs:string">Novi Sad</p:Mesto>
        <p:Datum property="pred:datum" datatype="xs:date">2012-02-10</p:Datum>
        <p:Vrsta property="pred:vrsta" datatype="xs:string">Zakon</p:Vrsta>
        <p:Naziv property="pred:naziv" datatype="xs:string">Pop me smara jer ne ume da se igra sa pdf-om</p:Naziv>
        <p:BrUkupnihGlasova>0</p:BrUkupnihGlasova>
        <p:BrPozitivnihGlasova>0</p:BrPozitivnihGlasova>
      </p:Meta_podaci>
    </p:Akt_u_proceduri>
  </p:Sporedni_deo>
</p:Akt>